{
  "anchored_subject_type": "bundle_manifest",
  "anchored_subject_hash": "99c16bca0981c8fa7e72ddbd27e1678a135ecdbc0e068b3b611d19a519eb5319",
  "anchored_subject_hash_algorithm": "SHA-256",
  "anchors": [
    {
      "anchor_id": "anch:ots",
      "anchoring_method": "opentimestamps",
      "anchor_profile_ref": "axes:opentimestamps_sha256_digest@1",
      "basis_status": "demonstrated",
      "anchor_commitment_hash": "99c16bca0981c8fa7e72ddbd27e1678a135ecdbc0e068b3b611d19a519eb5319",
      "anchor_commitment_hash_algorithm": "SHA-256",
      "anchor_requested_at": "2026-10-04T16:48:47.000Z",
      "anchor_service_id": "bip122:000000000019d6689c085ae165831e93",
      "anchor_operator_id": null,
      "anchor_proof_ref": "proofs/opentimestamps/proof_manifest.json",
      "anchor_proof_hash": "9b514f4dfb3b59d1a0329608c333d679f9e2a7ea141c1bf0b5861eb4bc430aaa",
      "anchor_verification_procedure_ref": "docs/anchoring-profiles.md#axesopentimestamps_sha256_digest1"
    },
    {
      "anchor_id": "anch:tsa-freetsa",
      "anchoring_method": "timestamp_authority",
      "anchor_profile_ref": "axes:rfc3161_sha256_imprint@1",
      "basis_status": "demonstrated",
      "anchor_commitment_hash": "99c16bca0981c8fa7e72ddbd27e1678a135ecdbc0e068b3b611d19a519eb5319",
      "anchor_commitment_hash_algorithm": "SHA-256",
      "anchor_requested_at": "2026-10-04T16:48:50.000Z",
      "anchored_at": "2026-10-04T16:48:51.000Z",
      "anchor_service_id": "https://freetsa.org/tsr",
      "anchor_record_ref": "serial:0x08DF9C45",
      "anchor_operator_id": "https://freetsa.org",
      "anchor_proof_ref": "proofs/timestamp_authority/proof_manifest.json",
      "anchor_proof_hash": "b0a64bc3e75a98469b46927372c3a226a56292cd46b2d4f52f0cd0b0b9b1c8ee",
      "anchor_verification_procedure_ref": "docs/anchoring-profiles.md#axesrfc3161_sha256_imprint1"
    }
  ]
}
