{
  "anchored_subject_type": "release_statement",
  "anchored_subject_hash": "d8b6a69f57ba2209561fb551443c096c47fcb0cb6db37005fd0713690de88299",
  "anchored_subject_hash_algorithm": "SHA-256",
  "anchors": [
    {
      "anchor_id": "anch:anchor-registry-8453",
      "anchoring_method": "distributed_ledger",
      "anchor_profile_ref": "axes:anchor_registry_bytes32@1",
      "basis_status": "demonstrated",
      "anchor_commitment_hash": "d8b6a69f57ba2209561fb551443c096c47fcb0cb6db37005fd0713690de88299",
      "anchor_commitment_hash_algorithm": "SHA-256",
      "anchor_requested_at": "2026-10-23T14:09:55.000Z",
      "anchored_at": "2026-10-23T14:09:55.000Z",
      "anchor_service_id": "eip155:8453:0x49feca52bc634a9ab773226d16619dec547794aa",
      "anchor_record_ref": "tx:0x4d4b45f7ddb970bf37a640d651f24bc0e26a4acdb2e14285c19a9f3f95c720f7",
      "anchor_operator_id": null,
      "anchor_proof_ref": "proofs/distributed_ledger/proof_manifest.json",
      "anchor_proof_hash": "3b149bf120980b0f409ef99c27ba8c3852cb8965f9f983f43ba1bd0c9c2cf17b",
      "anchor_verification_procedure_ref": "docs/anchoring-profiles.md#axesanchor_registry_bytes321"
    },
    {
      "anchor_id": "anch:ots",
      "anchoring_method": "opentimestamps",
      "anchor_profile_ref": "axes:opentimestamps_sha256_digest@1",
      "basis_status": "demonstrated",
      "anchor_commitment_hash": "d8b6a69f57ba2209561fb551443c096c47fcb0cb6db37005fd0713690de88299",
      "anchor_commitment_hash_algorithm": "SHA-256",
      "anchor_requested_at": "2026-10-12T10:12:24.000Z",
      "anchor_service_id": "bip122:000000000019d6689c085ae165831e93",
      "anchor_operator_id": null,
      "anchor_proof_ref": "proofs/opentimestamps/proof_manifest.json",
      "anchor_proof_hash": "3dd461864df0a2ee3878393b0b4aa05f05a2baf5de1dcd1ae47b2c6a9491d4ce",
      "anchor_verification_procedure_ref": "docs/anchoring-profiles.md#axesopentimestamps_sha256_digest1",
      "anchored_at": "2026-10-12T10:35:51.000Z",
      "anchor_record_ref": "block:971082:00000000000000000001866099083f25fb5d30324416fb11eaa504895f86d24e"
    },
    {
      "anchor_id": "anch:tsa-freetsa",
      "anchoring_method": "timestamp_authority",
      "anchor_profile_ref": "axes:rfc3161_sha256_imprint@1",
      "basis_status": "demonstrated",
      "anchor_commitment_hash": "d8b6a69f57ba2209561fb551443c096c47fcb0cb6db37005fd0713690de88299",
      "anchor_commitment_hash_algorithm": "SHA-256",
      "anchor_requested_at": "2026-10-12T10:12:28.000Z",
      "anchored_at": "2026-10-12T10:12:28.000Z",
      "anchor_service_id": "https://freetsa.org/tsr",
      "anchor_record_ref": "serial:0x09216E25",
      "anchor_operator_id": "https://freetsa.org",
      "anchor_proof_ref": "proofs/timestamp_authority/proof_manifest.json",
      "anchor_proof_hash": "8023de4224bc5396be73a327ec0b2ca571ab351cdca23954f9a948fe57a14169",
      "anchor_verification_procedure_ref": "docs/anchoring-profiles.md#axesrfc3161_sha256_imprint1"
    }
  ]
}
